Stress1,Stress1Ex,Stress2,Stress2Ex,Stress3,Stress3Ex,Strategy1,Strategy2,Strategy3
my job,I am overworked and I'm on my feet all day dealing with straining workloads because the pharmacy is understaffed.,pain,pain from my injuries from my carwreck and my feet hurt all the time because my employer does not give me breaks and I'm on my feet constantly all day.,I have depression and anxiety,I've had a hard life and I cant control these side effects of life.,I try to be positive and think of my family.,Im continuously bettering myself so that I can get a better job and not have to deal with this company too much longer I hate rite aid.,I take anit anxiety medication to help me cope with reducing the symptoms of my anxiety . I also like taking long hot baths that is something that always makes me feels better.
office ,office work,travelling,long distance travelling,phone,more watching in phone,sleep,tea,sitting ideal
Financial Issues,"My financial status is not as good as it used to be, money has been tight this year and that is very stressful.",Family Life,There has been a lot of drama going on in my family this year. ,School,"Being a law student can be stressful, especially around finals. ",Meditation,Sleeping,Talking to friends about it. 
work,customers problems,children,trying to get homework done and get them to their activities,money,trying to make ends meet,mendation,a long hot bath,doing something I enjoy
My workplace,My workplace is chaotic and very unorganized. ,My teenage daughter,My daughter has gone from a very sweet person to a moody teen who spends her time with her face in her cell phone.,My relationship with my partner,My partner does not communicate with me very well.,I try to organize my day and get my work done and not be surprised by the constant amount of change that happens most days.,I keep a positive attitude with my child and let her know I am available for her.,I am loving and respect his need for privacy.
money,I stress about making enough money to pay my bills,retirement,stress about if I have enough money to retire,health,stress about my overall heath,work overtime to have enough money,talk to a financial planner about retirement,Visit my doctor on a regular basis
work,long hours,family,arguments and fights,wife,disagreements,smoke,friends,club
My cats ,They scratch things,Driving,People don't use turn signals,Tax on marijuana,"Didn't pay taxes before legalization, now it's through the roof",Cat scratchers and trim nails,Use my turn signal and lead by example,Smoke more marijuana.
Job,Being without a job is so stressful cause you can't support youself,House ,Paying rent and other bill is so stressful for me cause you need to hustle very hard to pay my rent ,Love,Love is the most wonderful thing on earth bt at times it's so stressful if your significant other is cheating ,Meditation by smoking weed ,Visiting my friend and family ,Working Out In the gym
work,too many things to worry about at once,home life,"kids, meal planning, cleaning, cooking",time management,don't have enough time to do things,drink alcohol,workout,take baths.
Money,We dont make enough money for our goals. ,Loneliness,We moved from a city with many friends to a town with few,Fatigue,We both work ourselves silly.,We try to indulge in stress relief that doesn't cost money like couple nights in.,We try to make new friends and use the isolation to bond more as a couple,Drinking and sleeping in on the weekends.
Family stress,When your spouse needs all your attention,Work Stress,Trying to get everything done in a short period of time,Personal stress,trying to be the person I want to be,"deep breaths, time away",slowing down intentionally,journalling
work,dealing with people all day and meeting deadlines,money,whether i am able to save enough,traffic,things that make my commute longer,tell myself it will be a good day,don't go crazy spending money,know that traffic will always exist
repeated conditions,if anybody repeated tell same matters i god irritated,Cheating me,if some cheatting me..i got tension,work pressure,Doing many things at the same time can lead to headache,meditation,move to another place,watching comedy shows
work,as a physician i have stress on a daily basis at work,Money,There never seems to be enough money,The future,The uncertainty of the future causes me stress,Read,Watch TV,Drive
children,they are all at different stages in heir lives,husband,hes a loser,limited availablity,i can't do anything for anyone because i always have something going on with the kids,get a good nights rest,walk away from him,deep breaths
Work,"Work sometimes has unreasonable demands that must be met, requiring overtime and time removed from family.",Family,Family can nag and be very demanding as well. Can ask for too much leading to inability to provide other things in their lives,Commuting,Sitting in traffic causes much stress and frustration. ,Meditation,Reflective practice,Speaking to others
Money,always create stress when we have empty,work,incompleted targets,relatives,creating problems,remain calm,think more possibilities,consulting elders
Finaces,Bills adding up,Security,Not having job security,Children,Not having a plan ,Organize well,Plan for the unforeseen,Plan for what i can control
future,the fear in the future,my lover,the lost of my lover,my ambition,the lost of my ambition,sleep,videos and songs,movies
job,Not really happy with it right now and some days are worse than others,Bills,Never enough money to provide for family as much as I want,World events,It's been frustrating watching the country become a laughing stock,Look for strategies to remotivate myself in my job,Budget and look for ways to cut costs,Vote blue and hope for Mueller 
money,making sure there is enough money for bills,relationship,trying to maintain a successful relationship,kids,life is very busy,plan out a budget,work on communication,organize
Work,I am 100% commission so that is always scary.,Time,Never enough time to do everything!,Sports,I am a passionate sports fan.,Try and be more systematic.,Try and just do what I can.,I embrace the sweat.
my job causes stress,me paying rent on time,me getting food,me worrying about my family,me worrying about dying alone,my education,i have none,make more money,be a less lazy piece of shit.
Money,As a stay at home mom I often stress about not being able to contribute financially.,The safety of my children,"I stress about the safety of my children often, between sports, the increase of school shootings, and just their overall health.",Meeting my family's needs,"As a mom and a wife, I often stress about adequately meeting the needs of my family.",I try to pray when I am feeling too overwhelmed.,I also try breathing techniques that I learned from doing yoga.,I may have a glass of wine sometimes to unwind.
relationships ,people I love not getting along,finances ,unexpected expenses,time,feeling rushed all the time,I pray a lot.,I re work the budget.,I make lists.
ANGRY ,when someone scold me i get angry,JOB STRESS,over work load cause stress,IRRITATING,when anyone irritates me,Patience,calm,Don't caring
Bills,When your paycheck is not quite enough to make ends meet that week.,my moms illness,My mother has MS and I worry constanlty and always asking what if?,Car problems,Drive an older car and seems like there are always issues,Cigarettes,yoga,try not to think about it
Children,I worry about my kids no matter what! ,My health,I have type 2 diabetes and it is hard to control for me.,My animals!,Sometimes my animals can be a handful ad expensive!,To keep them safe as much as possible.,To eat healthy and exercise. ,Make more money I guess!
not having enough time in the day,I am always so busy and don't always have time to get done everything I would like to get done.,body image,I am stressed out about how much I weigh and why I can't seem to lose the weight.,kids,I have four children and I get stressed out worrying about them all the time.,look to my husband for support,try to think about things that are more important than looks,remind myself of all the good things I have in my life
Bills,How to pay,Food,Have money for grocery,Kids,Take care,Prayer,Fast,Going to church
WORK,I hate to work,My father,I hade to take care of him because he's old,Friend,I found it difficult to deal with people,I'm unable to dea with stress cause by work,I try to ignore him the most I can,I try to be alone as much as I can
Financial,Struggling to find money to pay the bills and find consistent work.,Fighting With Loved Ones,Any conflict with people I am really close to sends me into a downward spiral.,Mental Health,"I struggle with ptsd, agoraphobia, anxiety, panic, etc. (They affect day to day life)",The best means of financial stress is good budgeting and preparing for set backs.,To deal with a conflict with loved ones you need to step out of the situation and wait until emotions are low and can speak rationally.,"Mental health is complex but to deal with it I use therapy, coping skills and a good support system."
My family problem,They didn't live together,Job,My job is not secure for me,Health,Often i have health issues,Meet with the doctor,Meet with the doctor,Meet with the doctor
Career,Concern about building up a lifestyle that requires a high paying job and then losing said job,Health,Concern about future health problems based on current situation,Interpersonal,Close friend has addiction issues,I use meditative thought to deal with this.,I use meditative thought to deal with this.,I use a counseling program to help with friend.
disabled child,"Managing depression, anxiety, and adhd in a child is extremely stressful.",teenager,Managing mood swings in a 16 year old female.,Osteochondral disease of my ankle,Last year I developed a hole in my talus along with cartilage loss which causes severe pain.  ,"Deep breaths, pray, and communication helps me deal with the disabilities.  ",Learning how to bite my tongue and letting things go helps with dealing with a moody teenager.,Cortisone shots and taking one step at a time helps with my ankle stress.  
Work,"Deadlines, issues",Children,"Sport appointments, homework",Traffic,"Lots of traffic each way to work, kids school",Plan out schedule to get things done at work.,"Time management for homework, commuting with other parents for sports.","Soothing music, leave time to get to destination."
exam,in exam days mostly all the people have stress,office,if any project assigned me and hurry up the work means i have stress,thinking more,more thinking cause stress,drink water as much more,submit the project an correct date,make as busy all time 
Sitting in traffic after work.,Too much traffic on the roads.,Having to deal with supervisors and co-workers.,Miscommunication and lack of team work. ,Having time to clean the house,Washing and cleaning clothing and dishes.,Try to find different route home thats less traffic.,Talking to the co-workers that are not talking or don't know whats going on.,Trying to get some help to finish chores.
exam,exam time stress,thinking over,over unwanted thinking make more stress,office,work stress,feel as much relax,dont think about stressful happens,feel free to home
Work,"Going to work, making sure meet deadlines",Traffic,Driving when there is along of traffic,Paying bills,Making sure I meet my buget,"Make sure to do product right first time, don't procrastinate",Listen to music,Pay Bill once a month
at work,I am a part of the Release team and hence there is always pressure to finish it before deadline,morn time at home,"Mornings are always hectic making breakfast for the family, and getting ready for work ",driving,"with too much of traffic around, it is very stressful to drive",a 2 min meditation often,have a strong cup of coffee,carpool sometimes
tension,thinking about some other,overthinking,unwanted thoughts,fight,fighting close person,apologise,move away from that place,long sleep
work,due to stress from boss,mobile,lot of messags coming from the clients,wife,always making noise,arrange my works routine,prepare someone to attend the calls,go away 
money,don't make enough,public,people are awful,yardwork,hard to do ,do surveys,stay home,get boyfriend to help
husband,We aren't always in a good place,school and afterschool activities,I homeschool my child and the pressure of that is sometimes overwhelming.,money,There is never enough,I try not to let my temper get the better of me,I try to prepare ahead of time more often,I work as much as possible
Money,Paying bills and saving enough for the future.,Relationships,Keeping and making friends. ,Self Esteem,Working on self improvement and sticking with fitness goals.,I research ways to save money.,I try to keep in contact with friends so they know I am there for them.,I go to talk therapy with a counselor.
health issues,possible complications arising from existent problems,money,not enough resources,family,life problems,"pray , its the best thing you can do","pray , god is the only one who can guide and help you","pray , and it will be ok"
tension,unwanted think,overthinking,unwanted thoughts,fight,fight with close one,stop thinking,avoid that place,long sleep
WORK,OFFICE WORK,FAMILY,MONEY,BODY,ILLNESS,YOGA,MEDITATION,WATCH SE-NARY
kids,"they are very demanding, usually without even realizing it",partner,"he's demanding too, he likes when i do a lot of things for him",driving,"i have anxiety disorder, every time I drive somewhere it's magnified by quite a lot",take care of everything they will need for the remainder of the day so I can be done,stay up later than him so i can have alone time,"take a quick nap before going anywhere, it resets my brain so I can think clearer"
Hard to fall asleep at night.,Always thinking too much.,Trying to help kids with homework.,"They sometimes get angry and make it hard to study, but they are my children I love them and I don't give up on them.",The thought of death terrifies me.,I don't like thinking of death it gives me great anxiety.,Meditate.,Reward good behavior with treats.,Try to think of other things.
Money,I stress about making sure that we always have enough money to pay bills.,Children's behavior,I stress about behavior outbursts from my children.,Car Repairs,I stress about our car and making sure that we can get all the proper repairs made to be able to get around.,Yoga at night is helpful.,Meditation seems to make it better.,Getting up a little earlier in the morning to have some quiet time to myself to start the day on a good note.
Communication,When there is no communication from the other party on an issue,Dishonesty,When people are dishonest especially about important things that stresses me,Uncertainty,When I don't know what to expect in difficult situations,request for feedback,Pray,Talk to other people
Work,"My work involves interacting with people frequently.  Some are not very nice, and I have a hard time dealing with this.",Money,There never seems to be quite enough.,Time,"There never seems to be quite enough free time to do the things I really want to do (sometimes, there's not enough time to do things I NEED to do).","I try to remain calm and positive at work, and I try to not think about work when I'm not there.","I remind myself that money is not the most important thing in the world, and that I do not really need much.","I try to enjoy whatever I do, even if it is cleaning the house."
family,when my family doesn't get along or are fighting,health,when my health or the health of my loved ones is not good,money,"not having enough to live, pay bills, rent, food, etfc",remove myself from the situation,see a doctor and work to resolve the health issue,make a budget and focus on saving money
Money ,Not enough money to pay what little bills we have let alone any emergencies or entertainment.,Getting along,My husband and our youngest son do not like each other.  They do not respect each other and they put me in the middle.,Illness,"My health is fair at best, my husbands is ok but not great.  We both have chronic pain, he has cancer and I have lupus.",Working MTurk to bring in more money.,Youngest moved out and they stay away from each other.,We try to take care of ourselves and keep up with Dr appts.
Work,Long hours and constant deadlines.,Finances.,I barely make enough to pay all my bills.,School.,I went back to college and take classes at night in addition to work.,Remember that I have a good job in a field I love.,Remember that most people in the world have it much worse and barely having able to pay bills is still having enough to pay bills.,Remember that it will be worth it in the end and will help reduce the stress from the other two.
Health worries,"Joint problems, dietary concerns",Work deadlines,Constantly have projects due,Social obligations,Having to keep meetings with friends,Take a walk,Take a short break from work,View it as blessing
Health,My husband has cancer and his health is a huge issue ,Work,Taking care of my husband doesn’t allow m3 to h@v3 a full time job,Money,Everything is so expensive wh3n you are on a budget ,Alternatively treating cancer,Find more work,Save more
salary,dealine,project,Weight,Family,friends,Work exercises,Listen the music ,eat
financial planning,future is scary for people that graduated during/soon after recession,job security,again - the recent recession didn't set me up the best,cancer,my father in law has stage 4,daily yoga practice,strength training,breathing techniques 
Health issues,Having problems with my weight,Work issues,Lots of stress at work learning new softward,Financial issues,Money seems tight with lots of upcoming repairs to home,seeing doctor on a more regular basis,taking it slowly so I won't have to repeat training,Trying to stick to a budget
Finances,I would like to be in a better financial position.,Motherhood,I sometimes feel that there are not enough hours in the day to fulfill all my duties.,Bills,I feel the bills come around so quickly.,I organize my spending habits and make sure I work hard to earn enough and save up.,I make sure that my kids & my household are well taken care of and choose not to stress over the insignificant things in life.,I mark all my bills on my calendar and make sure they are taken care of well before the due date.
money,need money for life,health,need to keep up on health ,life in general,quite stressful to think of life,i focus on meditation,i listen to music,i try to find companionship
Traffic,Driving on congested roads (especially freeways),Money,Worry about too much debt and how to pay it down,TV violence,Even ads on TV seem to depict violence,"When stuck in traffic, I remember to takke deep breaths","With debt, I do my best to analyze how best to use my income to pay it down; I practice logical approach",I turn off the TV and sit quietly in meditative thought about nature
work,losing my job soon,home,getting home diy projectsdone,church,dealing with church drama,think about new job opportunities,focus on small things,relax
Work Pressure,Work place pressure is one of the main cause of the stress,Family Issues,Another One of the main problem of the stress is Family Issues,Health Related Issues,While Compared with Both of the above Health related Issues is the Very Worst Stress Situtation,While at the time of work taking a long breath between timings,Talking to solving the issues through families,To take medicine or advice to having more excercies
Disabled mom,I am her caregiver and she treats me like crap.,Work,The kids are sometimes stubborn and refuse to listen to me.,Money,My family is poor and i'm afraid we might lose our house.,I let it out and cry.,I play video games.,I buy stuff I want.
My husband,he is struggling with depression,My step-son,he is struggling to keep a job,An upcoming vacation with my husband,the last vacation he stayed angry for two days because I didn't go into a shoe shop I said I might like and choose to continue walking instead (I still do not understand this!),Remind myself that these issues are not of my making,Short 1 or 2 minute meditations when I get frustrated/upset,"If these don't work, I tend to either read, do yoga, or go for a walk."
Applications,PhD Applications,Family,Getting texts or calls,Acquaintances,Random questions,I do a little a day,I ignore them,I try not to interact
Lack of money causes me stress.,I need more paying clients.,Boredom causes me stress. ,I have a circadian rhythm disorder so I'm awake at night instead of the day--it gets boring at 2 am.,Health issues cause me stress.,Multiple autoimmunes are a PITA to deal with.,Advertise to try to get more Tarot clients.,"Read, play video games, watch movies, play w/the cats.",See the doc on a regular basis and make sure my meds are at the right dosages.
Health,I am worried that I might get a serious disease,Finance,I am worried that I will run out of money in the future,Work,I am worried that I will not be able to get the job that I want; I will be stuck in my current job which I dislike,I eat healthy and exercise regularly,I save as much money as possible,I try to connect to the companies for whom I want to work for on social media
work,a lot of people,how i look,i dont like how i look,school,trying to make good grades,tell myself the workday will go by fast,tell myself im not ugly,tell myself i will pass this class
Finances,Not having enough money to meet our needs and let me stay home with the kids.,Living situation,Knowing our lease expires soon and not knowing where we should go next,Health,Having had a pain in my neck for many years with no answers,"I talk to someone about my worries and concerns, specifically my husband.","I pray to God for peace, faith and for His provision.",I exercise to reduce tension and help me sleep better.
Work,The people I work with get on my nervs,Bills,Trying to keep up with bills is hard sometimes,Politics,watching how the country is doing is always stressfull,Try to avoid the trouble makers,Planning out a budget,Take a break from the news
Work,Nurse at hospital ,Wife,Grumpy ,Child,Acts up,Beer,Cigarette,Long drive
Money,Not having enough money,Work,Not making enough money at work,Pets,Having a pet get sick and die,I try to work extra hours and do side jobs.,I try to come up with other small jobs I can do to make extra.,I take my pets to the vet regularly and try to keep them healthy.
grades,i want high grades ,exercise,i am trying to lose weight,money,i am trying to save money,study more and do not procrastinate,look up workout plans,don't spend too much money
money,I get paid very little for as much as I work,time,I work many hours at multiple jobs ,my car,"my car keeps breaking and I can't afford to fix it or trade it for a new one, and I still have 2 years on my lease agreement.",Work more or find a new job that pays significantly more.,Sacrifice comforts or find a job that pays significantly more.,Sell the car to pay off loan remainder and find a job closer to home that I can walk to.
Kids,The kids make messes very often and I am a neat freak.,Bills,I always have to make sure they are paid on time.,Work,I have to make sure it is done quickly and accurately.,I take a deep inhale and exhale with eyes closed.,I use scented candles to relax me.,I play Call of Duty to let out any hostility allowing the stress to grow.
Not having enough money,Only working one job,Living with many different people,Splitting rent multiple ways to make ends meet,Worry partners do not like each other,Polyamorous; dating 2 people seriously at same time,Budgeting or otherwise tracking and watching spending habits,"Go outside and hang out with friends, or build good terms with roommates","Encourage communication with all parties involved, take special time for each of them"
money,Not having enough money to pay for all the things my family needs,time ,not having enough time to get everything done I need to do,health,not being able to lose enough weight to be healthy ,work more and reduce expenses,balance my work and home life better,take steps to improve my health
Court,My abusive ex-boyfriend has pretrial next week that I have to testify at. ,Work,"My job has cut hours because the election is over, and now I barely have an income",Future,I graduated from college years ago and have never done anything that has to do with my degree.,"I organize and plan out every task that I have to do, so that I can at least get the bare minimum done.",I try to work as much as possible to make money and feel accomplished.,"If those dont work, sometimes I might turn to drinking."
Being busy,Too much going on makes it hard to focus on any one thing,Money,Needing to make difficult choices,Work,Balancing the needs of multiple clients,Prioritizing committments,Creating a budget,Prioritizing projects
Money,Having money to pay the bills,Yard,Keeping up the yard work year round,Sports,Watching my sports teams play,Work as much as I can,Manage my time so I can keep up,Gamble to where I can win even if my team loses
ACUTE STRESS,"Acute stress is usually brief. It is the most common and frequent presentation. Acute stress is most often caused by reactive thinking. Negative thoughts predominate about situations or events that have recently occurred, or upcoming situations, events, or demands in the near future.",EPISODIC ACUTE STRESS  ,"People who frequently experience acute stress, or whose lives present with frequent triggers of stress, have episodic acute stress.",CHRONIC STRESS,"Chronic stress is the most harmful type of stress. If chronic stress is left untreated over a long period of time, it can significantly and often irreversibly damage your physical health and deteriorate your mental health.", Be careful about what you eat and drink.,Take regular exercise.,Improve your study skills.
