Stress1,Stress1Ex,Stress2,Stress2Ex,Stress3,Stress3Ex,Strategy1,Strategy2,Strategy3
Husband,Abusive ,Financial,Need enough to leave safely,My kids,Make sure they always have what they need  & to know they are loved.,Spend quality time with my son,Smoke cigarettes,Write in a journal
Americans say they fight with friends and loved ... o,you more aware of things around you and keep you more focused. In some cases stress can give you strength and help you get more done. ... ,"Employers should provide a stress-free work environment, recognise where ... See the separate article on workplace wellbeing for a detailed explanatio","Let's look at each of these types of stress in detail, and discuss how you can ... You worry about the number of things that you have to do, and you fear that you'll .","Stress occurs when you perceive that demands placed on you — such as work, ... Some stress can be beneficial at times, producing a boost that provides the driv","Controlling stress is an active process which means that you will have to take ... Try to eat a well balanced diet, eating at least three regular meals a day","At times it may seem that there's nothing you can do about stress and indeed ... Unfortunately, while these strategies can give some short-term ",regularly is one of the best ways to relax your body and mind. .,this simple strategy can help you keep things in ... Take a break from a stressor. ... but when you give yourself permission to step away from it you can ... Be aware of your unhealthy coping methods to dealing with stress.
business, work hard,money, making money is really hard,child, it is very important to deal with children, herbal tea,sport, go on vacation
Finances ,Making sure I have enough income to support my lifestyle,Work,"meeting deadlines, interacting with coworkers/supervisors",personal relationships,making time for friends and family,re-examine budgets and debts,"re-evaluating progress at work, remaining calm during interactions with colleagues",setting aside one day a week for spending time with loved ones
Marital issues ,Argument with spouse,Children ,caring for young children is challenging ,Money,Trying to manage with limited income,Talking through problems with my spouse ,Being patient when children are being difficult ,"Developing strategies such as shopping sales, buying used items."
Finances ,Concern over making the bills and all other needs met.,Vehicle Maintance,keeping and making sure all maintenance is done so I can stay on the road with no surprises.,Kid's,"I have 2 children not school age, my oldest has a couple disabilities that make normal everyday occurrences a challenge. ",Breathing,Stepping away,Asking husband for help
job,Target achievement is main stress  ,Maintained home needs ,Need to full fill the home needs ,Weight loss,Trying to reduce weight,Usually i can do yoga so job tension reduced,I can share work with my family members,doing  some regular activity like walking
fear of loss of Job,"unstable job market, uncertainties & unethical practices in employment creating stress due to fear of probable financial implications",Relationship,Huge expectations & greed for luxury life by spouse creating unnecessary stress in day to day life & relationship,when feeling powerless,"certain situations in day-to-day life when forced to deal with anti-social elements, corrupt co-workers & un-ethical people develops stress as we feel helpless","Improve performance at job, try to achieve more than expectation","Try to avoid confrontation, minimize arguments, extend freedom",Trying to learn methods & ways to fight it out or get away
money,My wife spends money too quickly before we can save,Children,I worry about them getting what they need,Job,I am in the military and have to move away from home alot.,I take more control of money,I stay closer to my son,I am close to retiring
work,hard work,family,comitments,friends,comites,free,free,free
money,new expenses all the time,coparenting,dealing with ex,work,shift work hours,work overtime,patience,take vacations
Work,When my work is not what I expected.,myself,When I make mistake.,family,When my family is unhappy.,calm down,try to figure out what happens,find solution
The Future,Stressed about getting a better job.,Relationships,Stressed about getting married and starting a family.,Work,Stressed about performance at work,Play video games with friends.,Work out.,Talk with my girlfriend.
Money,Not having enough money for all things I would like to have is stressful.,Marriage,A dysfunctional marriage,Family,A judgemental family,I put my energy into my work.,Taking a drive is my solution.,Avoiding them as much as I can.
Workplace tensions,When work becomes more,Travelling in traffic,Waiting in the traffic,Relationship issues,Issues regarding relations,Relax,Yoga,Drinking water
Driving in traffic,Traffic is always bad when I commute to and from work.,My job,My job is quite hectic most of the time and is very stressful.,Injured knee,I have been living with an injured knee for about 3 years and have to use a cane to get around. I cannot have knee replacement surgery at this time.,Turn on the car radio and listen to music while driving.,Do my job to the best of my ability and make sure that I take my breaks. ,I use a cane and take prescription pain medication to deal with the pain. 
work,i am expected to get a lot done,money,i dont have enough of it,death,it sucks,get work done,sell things,avoid risky situations
Job,I work as a firefighter/emt ,Money,"I work on a volunteer fire department so I don’t make much money, and I live paycheck to paycheck",Relationships ,Family and personal relationships can cause me stress.,Working out ,Hiking and other outdoor activities ,Drinking 
Harrassment,Non civilized life,Liers,People who lie,Life,BS life,Cry,Starve,Sleep
finances,trying to save money for retirement,family,toddler acting out and not listening to instructions,household chores,nobody cleans up after themselves and I don't like clutter,I try to set aside $100 out of every paycheck no matter what.,I try to distract him with books and games.,I am constantly picking up so that the mess doesn't build up and get overwhelming.
Moving to a new home.,its a biggest stress,Getting married.,coolest stress,Loss of a job.,its a main problem,Exercise regularly. ...,"Eat healthy, well-balanced meals.",Learn to manage your time more effectively.
parents,they are always complaining,money,seems there is never enough,work,"so much to do, little time to do it",music,exercise,take walks
Work,My job sucks and I don't enjoy being there,Family,My family expects a lot of me,Love,My love life isn't where I want it to be,I try to ignore it,I try to meet these expectations,I tell myself things will get better someday
school,it's very hard,relationship,im very stressed about my girlfriend,roomate,he is annoying,fail,leave her alone,ignore
Drama,People actively trying to be difficult ,Health Issues,Diabetes control ,Eating healthy,Resisting the temptation to eat junk,I don't participate in the drama,I exercise a little and test my blood sugar,I eat healthy filling foods and think of the benefits 
Parents,My aging parents are dramatic control freaks,Kids,My kids judge me,My job,Hard fast paced ,Baths,Talk to friends vent deflate,Draw
Americans say they fight with friends and loved .,you more aware of things around you and keep you more focused,"Employers should provide a stress-free work environment, recognise where ","Let's look at each of these types of stress in detail, and discuss how you can ... You worry about the number of things that you have to do, and you fear that you'll ..","Stress occurs when you perceive that demands placed on you — such as work, ... Some stress can be beneficial at times, producing a boost that provides the drive","Controlling stress is an active process which means that you will have to take ... Try to eat a well balanced diet, eating at least three regular meals a day.","At times it may seem that there's nothing you can do about stress and indeed ... Unfortunately, while these strategies can give some short-term ",regularly is one of the best ways to relax your body and mind. ... Most of all remember that doing any exercise is better than none at all. .., permission to step away from it you can ... Be aware of your unhealthy coping methods to dealing with stress.
Running in the negative (financially) every month.,"Spending all of our money on bills, and having no extra for savings or ""cushion""",Dealing with my daughter's health issues,My daughter is 1 year old and in the 3rd percentile for height and weight - which has had doctors concerned since she first fell down on the lower portion of this curve,Meeting short timelines at work,I often get stressed when the work piles up and I have short turnarounds and a very full plate of projects to complete for our clients.,"Frequent budget planning, discussing finances openly with my husband, cutting back on luxuries (eating out)","Keeping open communication with my daughter's doctor, finding high calorie foods that she enjoys, and keeping her on a consistent daily eating schedule","Set realistic deadlines, work nights/weekends to catch up on the workload"
my job,i have a lot of tasks and a deadline,bank,I have a big credit at the bank,my girlfriend, My girlfriend is very jealous and in stressful pestilence,I drink a lot of cofee and i try to finish my work at time,I can't diminuate this stress cause,I often ignore it
money,always worry if we gonna have enough,kid,always worry about him,work,there is always that going on,positive thinking,always being reday for the worst,walks with my dog
Money,Keeping up with the bills is getting harder all the time.,Transportation,Broken down vehicles require asking for a ride all the time.,Health,Chronic illnesses with family members keep us on our toes.,Budgeting (and doing without at times),Being patient and taking advantage of opportunities as they come,Accepting that whatever the day brings will be the agenda of the day.
School,trying to get homework done by the deadline,Work,dealing with daily tasks that need to be done,family,dealing with kids needs,go for a run,have a drink,meditate
Health,Dealing with my illnesses.,Medications,Worrying about the cost of my medications.,Finance,Worrying about money.,Going to therapy.,Looking for discounts and talking with doctors.,Keep track and budgeting.
Money,My wife an I have had money struggles over the past year.,Relationships,Being married there are always differences and challenges,Work,I work in surgery and it is a very stressful environment.,I practice meditation using an app.,I see a therapist once a month.,I exercise regularly to boost endorphine levels.
health issue,various illness ,future,financial security,children,about their well being,taking proper medicine,trying to strengthening financial condition ,taking care of children
health,I have chronic health issues that impact nearly every part of my life.,work,I am a manager of two vet clinics with some very challenging doctors.,money,"I just purchased a house, making my financial situation tighter than it used to be.",I try to follow my doctors' advice and seek treatment early / often.,"I utilize various resources available to me - other colleagues, forums, and networking to assist me in coming up with ideas to handle the situations that arise.",I am doing some extra work on Mechanical Turk!
Worrying about my son.,He makes poor choices sometimes.,Worrying about my twin grandsons.,Their parents are divorced and they are having a hard time with it.,Worrying about my best friend's health.,She has diabetes.,I try to think of other things to occupy my mind.,I try to be available for them as often as I can be.,I try to see her as often as I can.
money,Having enough money to pay rent and bills sufficiently each month,health,Having to deal with migraines often without an acceptable medication, job,Having the program director constantly harassing me trying to get me to quit,Try to pick up extra money here and there and online,Continue using older methods of medication and meeting with neurologist,Go to work determined not to let the director get to me
Money,Not having enough money. ,My car. ,It needs a few things to be fixed. ,My house ,It needs a new roof. ,Exercise,Relaxing,Reading
Traffic,My daily commute from home to work and back is so stressful most of the time. ,Car Issues,Driving my car on a daily basis makes me worry about when it's finally going to break down on me.,Credit Card Payments,Not being about to make the minimum monthly payments. ,I try to leave for work early. ,I just cross my fingers.. ,I try to make the monthly minimum. 
Money,I want to have enough money to improve out quality of life.,Child,It's an ongoing struggle to make sure our 10 year old is making good decisions to learn how to live a good and healthy life.,Friends,It's a lot of work to maintain meaningful relationships with friends when life is so busy.,I do whatever I can to make extra money. ,I partner with my wife to share the responsibility of guiding our son.,"I do a lot of ""cold calls"" to friends to maintain ongoing relationships."
work,working,time,to slow,money,not enough,smoke ,drink,relax
Money,Lack of money puts a strain on your relationships.,Work,Due to poor management skills this creates unneeded anger and issues.,No schooling,Lack of schooling and funds for college creates lots of issues in life.,"Exercise, IE: Running and weights",Talking with someone. ,Petting your animals.
Finding new job,I was recently laid off from my job.,Paying my bills,I was recently laid off from my job.,Getting money for food ,I was recently laid off from my job.,Looking for another job so that I can get an income again.,Collecting unemployment so I can pay my bills.,Sleeping when I can't afford food that way I'm not hungry.
work related stress,due to more work load i feel sometimes stress,in relationship,if any  problems in family it causes me stress,physical condition,if i am sick i am getting more stress,feel free mentally to reduce stress,try to avoid problems,eat healthy food
work,target,family,children future,society,self discipline ,yoga,meditation,listening to music
My finance causes me great stress.,I don't make enough to keep up with my expenses.,I am not where I want to be career wise.,I took a job with lesser pay because of the desire to stay in this town.,My health stresses me out.,I need to be more healthy.,Spend wisely.,Get a new job.,Be healthy.
Course work,I am often overwhelmed by the amount of work I have to do.,Relationships,Past and current relationships stress me out when I think about them too much.,Feeling inadequate or insecure,When I do not feel I have worth or that I am not doing a good job (in whatever I may be doing) I feel stressed.,Hanging out with good friends and family reduces stress.,Reading a good book reduces my stress.,Taking time to listen to new music or watch a show reduces stress.
Balancing home and work responsibilities,I take care of my 2 yr old by day and work overnight.,Not getting enough sleep.,Coming from work and hoping to get enough sleep before my son wakes up can be tough.,Not being able to stick to a savings plan.,We are always trying to save but never seem to be able to stick to it.,Just breathe and roll with it.,Sleep hypnosis and sleep meditation.,Talking it out with my husband.
Mom,Being a single mom of a three-year-old with no one to help with the help is very stressful as I don't have free time to myself.,Working mom,I work part-time to pay bills.,Finances,I actually don't have enough money to pay for all my bills and end up using my credit card for groceries.,I use deep breathing techniques with meditation.,I like have quiet alone time to myself.,I like to do light to vigorous exercises.
my health,I have a lot of health issues that make me worry a lot. ,My job,I work in a very fast paced environment. ,My pets ,They are constant attention grabbers and need a lot from me. ,Breathe ,Meditate,Relax. 
Money related issues.,"I often struggle month to month with meeting my obligations, and this sometimes stresses me out.",Family related issues.,"My family has a lot of different things going on with them, and although their issues are not always my problem, I can't help but to stress wondering if they're going to be okay.",Not being where I want to be at in life.,"I haven't accomplished a lot of the goals that I have set for myself, and it stresses me out knowing that I'm not living the life I want.",I try to actively pursue ways to add extra income.,I try to talk to and help them through their problems.,I make sure to exercise daily to help with the stress.
lack of funds,when i can not pay my bills,sickness,when i'm facing health problem,job problem,job crisis,find ways to get money,visit a doctor for medication,job pressure
JOB,work pressure,Money,not enough money in job,friends,most of my friends are rich and I don't feel good,gym,yoga,relaxation music
work,Taking on a new position with longer hours has been stressful.,home owning,Having to keep up with and take care of a house is stressful.,not having enough time,I feel like I never have enough hours in a day to get everything completed that I need to.,I like to hike to help clear my mind.,I go see a therapist every other week to help me keep my mind in order.,I try to get enough sleep so that I am physically and mentally sharp.
money,everything cost money! its stressful! im surprised the dont charge to breathe air.,Work,"making sur that i get everything done and get it done and time, is stressful",kids,"Though filled with lots of happiness, keeping a roff over there head and clothes on their back and food in their tummies is stressful",work more.,take it slow and just breathe.,take a spa bath when their sleeping haha
Money,Finances have always been a stressor and when money gets tight I start to worry.,Plans not going accordningly,"I am a planner and when things don't go as planned it stresses me out, I feel like I lose control.",Car troubles,When the car starts making an unknowingly funny sound out of no where I can't help but think how much money it is going to cost to fix it.,Reasoning,Taking a walk,Figuring out a solution and plan
school,getting good grades is hard,money,not having enough money,acceptance,not being liked by peers is not fun,i drink alcohol,i smoke cigarettes,i eat a lot of food
Lack of financial means,Too much student debt to pay off thus I don’t have enough financial means,Not being married,Getting older and yet I’m still not married ,Not being fulfilled in my career,Career is not fulfilling to me,Ignore it by watching tv or reading,Yoga and other workout classes,Go out to eat and hang out with friends
Work,Never enough help,Home,Too much to do and not enough time,Money,Never enough to get the things I want ,Train people better ,Plan to do certain chores each day,Find a better paying job 
Stress from running late.,"City of Los Angeles is very spread out and places often are far away from each other, so majority of people are running late or struggling with that on every day basis.",Stress from driving and dealing with too much traffic.,"I live in Los Angeles and there are tons of cars on the road everywhere at any given time of the day, but at some times it is terribly bad traffic and it is stressful to drive.",Depression.,"Battling ups and downs of depression that never really goes away, some days are better, some great but then inevitably worse again.",If I need to be somewhere important I leave earlier than supposed to so I double insure myself to be on time.,"Try to run errands and choose to go places at times of day and week when traffic is less. If I have to drive somewhere and it is a jam, I listen to audiobook and have a good time while ""sitting in traffic""","Meditate, read self help books, do aromatherapy, try to follow routine, listen to positive calming piano music, take a bath."
Working tarket Stress,My working company tarket complete Stress,Working Timing,Traffic late,Family problem Stress,Family Situation Stress,Working tarket Stress,Working Timing Stress,Family problem Stress
School Marks,Trying to get a good GPA in university,Religion,Trying to keep my parents happy by staying in their religion,Balancing life,"I have work, school, and religion to balance in my life",I manage my time and get help when needed,Talk to religious friends for advice,Taking breaks to do my hobbies
money,too many bills to pay not enough savings,relationship,its long distance,living situation,live with too many people,I work extra hours and sell items on ebay.,I try to talk with my partner every day and stay positive.,Find alone time outside of the house.
baby,just started to crawl,money,having enough money to pay rent,sleep,not getting enough sleep,making food helps get my mind off of things,making the baby laugh,getting out of the house
debt,I stress over money that I owe.,diet,I stress over eating healthy food.,co-workers,Some co-workers are difficult to work with.,I try to work extra to pay it off.,I keep only healthy foods in my house.,I try to worry about my tasks.
children,My children do above average risky behavior.,spouse,my spouse is currently incarcerated.,bills,Money comes after bills are due every month.,I meditate when youngest children are asleep.,I try to destress& clear my mind by watching cartoons.,I try to strategize how to prepay partial or full bill payments.
debt,i owe money in quite a few places,alcohol,i have a problem myself that i am working on but i live with two drunks,unemployment,i don't have a job and i honestly dont have the motivation to find one,i like to create so i knit or draw,i binge a lot of tv,i have an almost pack a day smoking habit
my husband ,he yells at me when he gets frustrated and he treats me like he hates me. ,money,no matter how much we make my husband thinks it is ok to spend whatever he wants ,bills ,i find it hard to pay bills on time due to my husbands spending,sleeping,medicaiton,music
Coworker,I have an ineffective coworker who does not do her job and the slack has to be picked up.,Retirement,I am working to save more money to retire at 45 and have to decide what expenses to cut while still enjoying life now.,Health,My toe has an ingrown toenail and it hurts and I need to go to the doctor.,I talk to my best friends and family about the coworker to vent.,I take time to do calculations on how much items cost and what that money could do in the long run as retirement savings to evaluate if expenses and budget changes are worthwhile.,I avoid thinking about it.
Work,Things at work can be very stressful. ,People,"People; usually at work, can also be stressful. ",Finances,Worrying about finances and being stable can be stressful at times.,Listen to music. ,Watch YouTube,Read. 
relax,close eyes and relax,breathe,close eyes and take a deep breath,walk,go out and take a walk,close eyes and relax,close eyes and take a deep breath,go out and take a walk
Work,working 10 hours a day is tiresome,children,running my household can be stressfull,traffic,sitting in traffic for hours can be stressful,take a warm bath,listen to meditational music,spend some time alone
Relationships,My relationship with wife is not working out.,Finance,I am not doing financially well,Health,I am having stress related health issues,Meditation,Working overtime,Exercise
Work,"I teach college students, so when my students plagiarize, don't follow instructions, I have grading deadlines for essays, etc., it can be stressful.",Children.,I homeschool my kids and have five of them; getting everything in and dealing with their behavioral problems can take a toll.,Money,"Every time things seem great, a major expense comes out of nowhere.","I pray, and it helps me stay calm and at peace.",I run because working out my body puts my energy somewhere and keeps me healthy.,I drink coffee or tea because I enjoy them.
School,All the work i have to complete for my classes is stressful,Driving,When I have to drive through traffic I feel stressed on how slow it is ,Money,Everything is so expensive nowadays so it's a hassle just to want things.,Watch youtube videos ,Eat dessert,Sleep
Finances,I stress that I will not have enough money to cover financial needs if I retire from the military,Family Health,I stress when I think my family is not taking measure to care for their own health,Weight,I stress about diet and exercise,Planning and budget spreadsheets,Research and discussions about probable cause of illnesses,Motivate myself to exercise
work,"I work over 45 hours every week, sometimes as much as 60",family life,"In addition to the many hours that I work, it's hard to keep up with family life but I try to.",romantic life,It's hard to give my husband the time and love that he deserves when I'm constantly working.,I workout when I can and release the tension.,I try to take the time to do something special with or for my family to show them that I love them.,I always do something for my husband to let him know that I'm constantly thinking about him and that I appreciate him.
Finances,I never seem to have enough money to get ahead or even keep up. ,Medical,"I have a lot of medical issues currently which are not only expensive, but they're trying to figure out how to treat it which sometimes makes me sicker. ",Exhaustion,I feel like I over extend myself and then I get so tired that I can't function. ,Marijuana,Anti anxiety meds,Walking the dogs 
Money,Not having enough money to pay bills.,Health,Health related issues in life.,Trump,The guy is a nut job.,Trying to save more.,Trying to get better and be healthier.,Trying not to think about it.
